{
  "base_commit": "8a10dc1e2cf2b5c80b26aee87fcf1ea056de09f3",
  "changed_files": [],
  "changed_units": [],
  "first_release": false,
  "global_bump": null,
  "head_commit": "8a10dc1e2cf2b5c80b26aee87fcf1ea056de09f3",
  "prepared_at": "2026-04-03T05:41:45+00:00",
  "prepared_from_commit": "8a10dc1e2cf2b5c80b26aee87fcf1ea056de09f3",
  "schema_version": "1.0",
  "units": []
}
